{
  "$schema": "https://json-schema.org/draft/2020-12/schema",
  "$id": "https://www.peacprotocol.org/schemas/conformance/interop-vector.schema.json",
  "title": "PEAC Interop Vector",
  "description": "Shape of a single interop fixture under specs/conformance/interop/<family>/{positive,negative}/. Interop vectors are repository interoperability fixtures, not normative conformance corpus entries. Each negative vector declares its expected failure as fixture-scoped descriptive strings; these strings are not stable PEAC error codes.",
  "type": "object",
  "additionalProperties": false,
  "required": ["$schema", "description", "vector_id", "input"],
  "properties": {
    "$schema": {
      "type": "string",
      "description": "Relative or absolute reference to this schema document."
    },
    "vector_id": {
      "type": "string",
      "pattern": "^[a-z][a-z0-9-]*-v[0-9]{2}-[a-z0-9-]+$",
      "description": "Kebab-case identifier prefixed with family slug and v<NN>- ordinal, for example erc8126-attestation-format-v01-jws-attestation or ap2-open-mandate-hash-v04-non-sha256-digest."
    },
    "description": {
      "type": "string",
      "minLength": 1,
      "description": "Single-line human-readable summary of what the vector exercises."
    },
    "input": {
      "type": "object",
      "description": "Vector payload. Shape is family-specific and described in the family README."
    },
    "expected": {
      "type": "object",
      "description": "Present on positive vectors only. Family-specific. Typical fields: canonical_bytes_sha256_hex (lowercase hex SHA-256 of the JCS canonical bytes of input), open_mandate_hash, attestation_carrier."
    },
    "expected_failure": {
      "type": "object",
      "additionalProperties": false,
      "required": ["kind", "reason"],
      "description": "Present on negative vectors only. The kind and reason strings are fixture-scoped descriptive labels; they are not stable PEAC error codes and must not be relied on as a public API.",
      "properties": {
        "kind": {
          "type": "string",
          "enum": ["validation_failure", "canonicalization_failure", "digest_failure"],
          "description": "Coarse classification of the failure surface."
        },
        "reason": {
          "type": "string",
          "pattern": "^[a-z][a-z0-9_]*$",
          "description": "Snake-case descriptive label for the specific failure. Fixture-scoped; not stable; not a PEAC error code."
        }
      }
    }
  },
  "oneOf": [
    {
      "required": ["expected"],
      "not": { "required": ["expected_failure"] }
    },
    {
      "required": ["expected_failure"],
      "not": { "required": ["expected"] }
    }
  ]
}
